{
  "contract_version": "2.0",
  "request_id": "render:ep-1:final:12-14",
  "episode_id": "ep-1",
  "video_url": "https://www.youtube.com/watch?v=ep-1",
  "mode": "final",
  "source_preferences": {
    "max_height": 2160,
    "prefer_best_available": true
  },
  "output": {
    "width": 1080,
    "height": 1920
  },
  "clips": [
    {
      "clip_id": 12,
      "start_sec": 124.3,
      "end_sec": 157.8,
      "title": "Why expansion failed",
      "narrative": {
        "main_topic": "why expansion failed",
        "ending_type": "CONCLUSION",
        "hook_end_sec": 128.0,
        "payoff_start_sec": 150.0
      },
      "layout_plan": {
        "preferred_layout": "auto",
        "expected_speakers": 2,
        "allow_split": true,
        "allow_blur_background": true
      },
      "caption_plan": {
        "language": "en",
        "cues": [
          {
            "start_sec": 124.3,
            "end_sec": 126.0,
            "text": "Most companies do not fail.",
            "speaker_id": "SPEAKER_00"
          }
        ],
        "highlight_terms": [
          "fail"
        ]
      },
      "editing_events": [
        {
          "time_sec": 130.0,
          "type": "punchline",
          "intensity": 0.9
        }
      ]
    },
    {
      "clip_id": 14,
      "start_sec": 440.2,
      "end_sec": 477.9,
      "title": "Why expansion failed",
      "narrative": {
        "main_topic": "second clip topic",
        "ending_type": "OPEN",
        "hook_end_sec": 443.0,
        "payoff_start_sec": null
      },
      "layout_plan": {
        "preferred_layout": "auto",
        "expected_speakers": 2,
        "allow_split": true,
        "allow_blur_background": true
      },
      "caption_plan": {
        "language": "en",
        "cues": [
          {
            "start_sec": 440.2,
            "end_sec": 442.0,
            "text": "Second clip begins here.",
            "speaker_id": "SPEAKER_01"
          }
        ],
        "highlight_terms": [
          "fail"
        ]
      },
      "editing_events": [
        {
          "time_sec": 445.0,
          "type": "emphasis",
          "intensity": 0.6
        }
      ]
    }
  ]
}