{
  "contract_version": "2.0",
  "request_id": "req-v2-word-timing",
  "episode_id": "ep-word-timing",
  "video_url": "https://www.youtube.com/watch?v=wordtiming01",
  "mode": "final",
  "source_preferences": { "max_height": 2160, "prefer_best_available": true },
  "output": { "width": 1080, "height": 1920 },
  "clips": [
    {
      "clip_id": 1,
      "start_sec": 10.0,
      "end_sec": 15.0,
      "title": "Word timed clip",
      "narrative": { "main_topic": "m", "ending_type": "c", "hook_end_sec": 11.5, "payoff_start_sec": 13.5 },
      "layout_plan": { "preferred_layout": "auto", "expected_speakers": null, "allow_split": true, "allow_blur_background": true },
      "caption_plan": {
        "language": "en",
        "provider": "youtube_manual",
        "transcript_version": "v3",
        "alignment_confidence": 0.94,
        "cues": [
          {
            "start_sec": 10.0,
            "end_sec": 11.2,
            "text": "the company nearly failed",
            "speaker_id": "guest",
            "words": [
              { "start_sec": 10.0, "end_sec": 10.3, "text": "the" },
              { "start_sec": 10.3, "end_sec": 10.7, "text": "company" },
              { "start_sec": 10.7, "end_sec": 11.0, "text": "nearly" },
              { "start_sec": 11.0, "end_sec": 11.2, "text": "failed" }
            ]
          }
        ],
        "highlight_terms": ["failed"]
      },
      "editing_events": []
    }
  ]
}
